Text,Rätt Kategori,Modell_Kategori,Tid (s),Rätt,Model,Antal Artiklar,Korrekt Klassifikation,Accuracy,Precision,Recall,CPU,GPU,Genomsnitt tid för artiklar
SUMMARY,,,0.24,786/2225,Mistral:7b,2225.0,786.0,35.33%,0.65%,0.31%,AMD Ryzen 7 9800X3D 8-Core Processor(4.70 GHz), RTX 4080-SUPER 16GB Vram,0.24 s
  prompt
    Läs följande nyhetsartikel och kategorisera den i EN enkel kategori:
    
    
    Viktigt:
    - Svara endast med en kategori (t.ex. Politik, Sport, Hälsa, Ekonomi, Kultur, etc.)
    - Svara bara med en kategori, skriv ej Bussiness (economy) exempelvis utan endast svara med EN kategori
    - Svara på Engelska
    - Om du tänker klassifiera kategorin som ekonomi skriv istället "business".
    
"Ad sales boost Time Warner profit

Quarterly profits at US media giant TimeWarner jumped 76% to $1.13bn (£600m) for the ...",business,Economy,0.49,False,,,,,,,,,
"Dollar gains on Greenspan speech

The dollar has hit its highest level against the euro in almost three months after the...",business,The article can be categorized under 'Business'.,0.26,False,,,,,,,,,
"Yukos unit buyer faces loan claim

The owners of embattled Russian oil giant Yukos are to ask the buyer of its former pr...",business,Business,0.17,True,,,,,,,,,
"High fuel prices hit BA's profits

British Airways has blamed high fuel prices for a 40% drop in profits.

Reporting its...",business,Business,0.19,True,,,,,,,,,
"Pernod takeover talk lifts Domecq

Shares in UK drinks and food firm Allied Domecq have risen on speculation that it cou...",business,Economy,0.19,False,,,,,,,,,
"Japan narrowly escapes recession

Japan's economy teetered on the brink of a technical recession in the three months to ...",business,Economy,0.15,False,,,,,,,,,
"Jobs growth still slow in the US

The US created fewer jobs than expected in January, but a fall in jobseekers pushed th...",business,Economy,0.18,False,,,,,,,,,
"India calls for fair trade rules

India, which attends the G7 meeting of seven leading industrialised nations on Friday,...",business,Business,0.18,True,,,,,,,,,
"Ethiopia's crop production up 24%

Ethiopia produced 14.27 million tonnes of crops in 2004, 24% higher than in 2003 and ...",business,Business,0.15,True,,,,,,,,,
"Court rejects $280bn tobacco case

A US government claim accusing the country's biggest tobacco companies of covering up...",business,Business,0.14,True,,,,,,,,,
"Ask Jeeves tips online ad revival

Ask Jeeves has become the third leading online search firm this week to thank a reviv...",business,Business,0.14,True,,,,,,,,,
"Indonesians face fuel price rise

Indonesia's government has confirmed it is considering raising fuel prices by as much ...",business,Economy,0.19,False,,,,,,,,,
"Peugeot deal boosts Mitsubishi

Struggling Japanese car maker Mitsubishi Motors has struck a deal to supply French car m...",business,Business,0.18,True,,,,,,,,,
"Telegraph newspapers axe 90 jobs

The Daily and Sunday Telegraph newspapers are axing 90 journalist jobs - 17% of their ...",business,Business (Economy),0.25,False,,,,,,,,,
"Air passengers win new EU rights

Air passengers who are unable to board their flights because of overbooking, cancellat...",business,"This article can be categorized as **Business** or **Transportation**. It discusses new EU rules regarding compensation for air passengers in cases of overbooking, cancellations, and flight delays. The changes will affect both scheduled and charter flights, including budget airlines, and could potentially lead to higher prices due to the increased cost of compensation. This has sparked criticism from various aviation associations and low-cost airlines. The new rules aim to deter airlines from overbooking flights and offer greater protection for passengers.",1.32,False,,,,,,,,,
"China keeps tight rein on credit

China's efforts to stop the economy from overheating by clamping down on credit will c...",business,Business,0.15,True,,,,,,,,,
"Parmalat boasts doubled profits

Parmalat, the Italian food group at the centre of one of Europe's most painful corporat...",business,Business,0.14,True,,,,,,,,,
"India's rupee hits five-year high

India's rupee has hit a five-year high after Standard & Poor's (S&P) raised the count...",business,Business,0.14,True,,,,,,,,,
"India widens access to telecoms

India has raised the limit for foreign direct investment in telecoms companies from 49%...",business,This news article falls under the category of **Business**.,0.3,False,,,,,,,,,
"Call centre users 'lose patience'

Customers trying to get through to call centres are getting impatient and quicker to ...",business,The article can be categorized as **Business** (or Economy).,0.39,False,,,,,,,,,
"Rank 'set to sell off film unit'

Leisure group Rank could unveil plans to demerge its film services unit and sell its m...",business,Business,0.19,True,,,,,,,,,
"Sluggish economy hits German jobs

The number of people out of work in Europe's largest economy has risen for the tenth ...",business,Business,0.19,True,,,,,,,,,
"Mixed signals from French economy

The French economy picked up speed at the end of 2004, official figures show - but st...",business,Economy,0.15,False,,,,,,,,,
"US trade gap hits record in 2004

The gap between US exports and imports hit an all-time high of $671.7bn (£484bn) in 20...",business,Economy,0.2,False,,,,,,,,,
"Yukos loses US bankruptcy battle

A judge has dismissed an attempt by Russian oil giant Yukos to gain bankruptcy protect...",business,The article can be categorized under **Law and Politics**.,0.31,False,,,,,,,,,
"Safety alert as GM recalls cars

The world's biggest carmaker General Motors (GM) is recalling nearly 200,000 vehicles i...",business,Safety,0.17,False,,,,,,,,,
"Steel firm 'to cut' 45,000 jobs

Mittal Steel, one of the world's largest steel producers, could cut up to 45,000 jobs o...",business,Economy,0.17,False,,,,,,,,,
"Strong demand triggers oil rally

Crude oil prices surged back above the $47 a barrel mark on Thursday after an energy m...",business,"The category for this news article is ""Business""",0.23,False,,,,,,,,,
"UK firm faces Venezuelan land row

Venezuelan authorities have said they will seize land owned by a British company as p...",business,Politics,0.19,False,,,,,,,,,
"Soaring oil 'hits world economy'

The soaring cost of oil has hit global economic growth, although world's major economi...",business,Economy,0.2,False,,,,,,,,,
"Irish markets reach all-time high

Irish shares have risen to a record high, with investors persuaded to buy into the ma...",business,Business,0.16,True,,,,,,,,,
"Japanese banking battle at an end

Japan's Sumitomo Mitsui Financial has withdrawn its takeover offer for rival bank UFJ...",business,Business,0.17,True,,,,,,,,,
"Rich grab half Colombia poor fund

Half of the money put aside by the Colombian government to help the country's poor is...",business,Economy (Business),0.18,False,,,,,,,,,
"Rover deal 'may cost 2,000 jobs'

Some 2,000 jobs at MG Rover's Midlands plant may be cut if investment in the firm by a...",business,The article can be categorized as 'Business'.,0.25,False,,,,,,,,,
"Ad firm WPP's profits surge 15%

UK advertising giant WPP has posted larger-than-expected annual profits and predicted t...",business,Business,0.13,True,,,,,,,,,
"US gives foreign firms extra time

Foreign firms have been given an extra year to meet tough new corporate governance re...",business,This article can be categorized under: Business,0.23,False,,,,,,,,,
"Japanese mogul arrested for fraud

One of Japan's best-known businessmen was arrested on Thursday on charges of falsifyi...",business,Business,0.18,True,,,,,,,,,
"Deutsche Telekom sees mobile gain

German telecoms firm Deutsche Telekom saw strong fourth quarter profits on the back o...",business,Business,0.13,True,,,,,,,,,
"Chinese wine tempts Italy's Illva

Italy's Illva Saronno has agreed to buy 33% of Changyu, the largest wine maker in Chi...",business,The given news article can be categorized under the category of **Business** or **International Trade**.,0.31,False,,,,,,,,,
"Umbro profits lifted by Euro 2004

UK sportswear firm Umbro has posted a 222% rise in annual profit after sales of repli...",business,Business,0.14,True,,,,,,,,,
"Fed chief warning on US deficit

Federal Reserve chairman Alan Greenspan has warned that allowing huge US budget deficit...",business,Business,0.16,True,,,,,,,,,
"UK Coal plunges into deeper loss

Shares in UK Coal have fallen after the mining group reported losses had deepened to £...",business,Business,0.14,True,,,,,,,,,
"Saudi ministry to employ women

Women will be employed in Saudi Arabia's foreign ministry for the first time this year, ...",business,Politics,0.12,False,,,,,,,,,
"Japan economy slides to recession

The Japanese economy has officially gone back into recession for the fourth time in a...",business,Economy,0.2,False,,,,,,,,,
"US crude prices surge above $53

US crude prices have soared to fresh four-month highs above $53 in the US as refinery p...",business,This news article can be categorized as 'Business' or 'Economy'.,0.32,False,,,,,,,,,
"Industrial output falls in Japan

Japanese industrial output fell in October while unemployment rose, casting further do...",business,Economy,0.17,False,,,,,,,,,
"Ryanair in $4bn Boeing plane deal

Budget airline Ryanair has placed an order for 70 Boeing 737-800 planes, in a deal va...",business,"This news article falls under the category of ""Business"" or ""Economy"".",0.31,False,,,,,,,,,
"Parmalat to return to stockmarket

Parmalat, the Italian dairy company which went bust after an accounting scandal, hope...",business,Business,0.16,True,,,,,,,,,
"BMW cash to fuel Mini production

Less than four years after the new Mini was launched, German car maker BMW has announc...",business,This news article falls under the category of 'Business'.,0.37,False,,,,,,,,,
"Bad weather hits Nestle sales

A combination of bad weather, rising raw material costs and the sluggish European economy...",business,"The article can be categorized under **Business** due to its discussion about the financial performance of Nestle, including sales figures, profit margins, and dividend payments.",0.52,False,,,,,,,,,
"Fiat mulls Ferrari market listing

Ferrari could be listed on the stock market as part of an overhaul of Fiat's carmakin...",business,Business,0.17,True,,,,,,,,,
"Italy to get economic action plan

Italian Prime Minister Silvio Berlusconi will unveil plans aimed at kickstarting the ...",business,The provided news article can be categorized as 'Business'.,0.33,False,,,,,,,,,
"Weak dollar hits Reuters

Revenues at media group Reuters slipped 11% during 2004, mainly due to the weakness of the dol...",business,The provided news article can be categorized under **Business** due to its focus on the financial performance of media group Reuters.,0.41,False,,,,,,,,,
"Hyundai to build new India plant

South Korea's Hyundai Motor has announced that it plans to build a second plant in Ind...",business,This news article can be categorized as 'Business'.,0.26,False,,,,,,,,,
"SA unveils 'more for all' budget

The South African government has put tax cuts and increased social spending at the cen...",business,The provided news article can be categorized as **Business** or **Economy**.,0.36,False,,,,,,,,,
"BMW drives record sales in Asia

BMW has forecast sales growth of at least 10% in Asia this year after registering recor...",business,Business (Ekonomi),0.22,False,,,,,,,,,
"Economy 'stronger than forecast'

The UK economy probably grew at a faster rate in the third quarter than the 0.4% repor...",business,The category for this news article is 'Business',0.29,False,,,,,,,,,
"Electrolux to export Europe jobs

Electrolux saw its shares rise 14% on Tuesday after it said it would be shifting more ...",business,The category for this news article is: Business,0.2,False,,,,,,,,,
"Worldcom ex-boss launches defence

Lawyers defending former WorldCom chief Bernie Ebbers against a battery of fraud char...",business,The category for this news article is: Business,0.24,False,,,,,,,,,
"Insurance bosses plead guilty

Another three US insurance executives have pleaded guilty to fraud charges stemming from ...",business,Business,0.12,True,,,,,,,,,
"Further rise in UK jobless total

The UK's jobless total rose for the second month in a row in December, official figure...",business,Economy,0.18,False,,,,,,,,,
"Wembley firm won't make a profit

Shares in Multiplex Group, which is building the new Wembley stadium, fell as much as ...",business,The news article can be categorized as 'Business' or 'Economy'.,0.34,False,,,,,,,,,
"Cars pull down US retail figures

US retail sales fell 0.3% in January, the biggest monthly decline since last August, d...",business,Economy,0.18,False,,,,,,,,,
"Lufthansa may sue over Bush visit

German airline Lufthansa may sue federal agencies for damages after the arrival of US...",business,Business,0.17,True,,,,,,,,,
"EU aiming to fuel development aid

European Union finance ministers meet on Thursday to discuss proposals, including a t...",business,Business,0.17,True,,,,,,,,,
"German business confidence slides

German business confidence fell in February knocking hopes of a speedy recovery in Eu...",business,The article can be categorized under: Economy,0.24,False,,,,,,,,,
"FAO warns on impact of subsidies

Billions of farmers' livelihoods are at risk from falling commodity prices and protect...",business,The article can be categorized as **Business** or **Economy**.,0.3,False,,,,,,,,,
"India seeks to boost construction

India has cleared a proposal allowing up to 100% foreign direct investment in its con...",business,This news article can be categorized as 'Business'.,0.27,False,,,,,,,,,
"Boeing unveils new 777 aircraft

US aircraft firm Boeing has unveiled its new long-distance 777 plane, as it tries to re...",business,"This article can be categorized under **Business** or **Aviation Industry**. Both categories are applicable, but given the focus on Boeing's new aircraft and its commercial aspects, it is more fitting to classify it under **Business**.",0.68,False,,,,,,,,,
"Circuit City gets takeover offer

Circuit City Stores, the second-largest electronics retailer in the US, has received a...",business,The article falls under the category of Business.,0.2,False,,,,,,,,,
"Japan turns to beer alternatives

Japanese brewers are increasingly making money from beer-flavoured drinks rather than ...",business,This news article can be categorized under the category of **Business**.,0.26,False,,,,,,,,,
"S Korean consumers spending again

South Korea looks set to sustain its revival thanks to renewed private consumption, i...",business,Business,0.15,True,,,,,,,,,
"German growth goes into reverse

Germany's economy shrank 0.2% in the last three months of 2004, upsetting hopes of a su...",business,Economy,0.15,False,,,,,,,,,
"Turkey-Iran mobile deal 'at risk'

Turkey's investment in Iran's mobile industry looks set to be scrapped after its bigg...",business,"This news article can be categorized as 'Business' or 'Politics'. The decision to cut Turkcell's stake in Iran's mobile industry and the potential withdrawal of the company from the $3bn deal, along with the implications for other foreign investments in Iran, suggest a political context. However, the primary focus is on business and investment deals between Turkey and Iran, making 'Business' an appropriate category.",0.96,False,,,,,,,,,
"EU ministers to mull jet fuel tax

European Union finance ministers are meeting on Thursday in Brussels, where they are ...",business,Business,0.14,True,,,,,,,,,
"Palestinian economy in decline

Despite a short-lived increase in Palestinian jobs in 2003, the economy is performing we...",business,Business,0.16,True,,,,,,,,,
"China had role in Yukos split-up

China lent Russia $6bn (£3.2bn) to help the Russian government renationalise the key Y...",business,Business (Economy),0.24,False,,,,,,,,,
"Deadline nears for Fiat-GM deal

Fiat and General Motors (GM) have until midnight on 1 February to settle a disagreement...",business,"The article can be categorized as ""Business"" or ""Finance"".",0.29,False,,,,,,,,,
"ID theft surge hits US consumers

Almost a quarter of a million US consumers complained of being targeted for identity t...",business,Business,0.15,True,,,,,,,,,
"Argentina, Venezuela in oil deal

Argentina and Venezuela have extended a food-for-oil deal, which helped the former to ...",business,"This news article can be categorized as **Business** due to the discussion about financial agreements between Argentina and Venezuela, specifically the extension of a food-for-oil deal, and the potential Venezuelan investment in Argentina's energy market. The mention of a state-owned South American oil company and the agreement to create 'Television Sur' also relate to business ventures.",0.89,False,,,,,,,,,
"BMW to recall faulty diesel cars

BMW is to recall all cars equipped with a faulty diesel fuel-injection pump supplied b...",business,This news article falls under the category of **Business**.,0.23,False,,,,,,,,,
"Takeover rumour lifts Exel shares

Shares in storage and delivery firm Exel closed up 9% at a two-and-a-half year high o...",business,The given news article can be categorized as **Business**.,0.25,False,,,,,,,,,
"Yukos accused of lying to court

Russian oil firm Yukos lied to a US court in an attempt to stop the Russian government ...",business,Business,0.21,True,,,,,,,,,
"Mexican in US send $16bn home

Mexican labourers living in the US sent a record $16.6bn (£8.82bn) home last year.

The B...",business,Economy,0.14,False,,,,,,,,,
"Home loan approvals rising again

The number of mortgages approved in the UK has risen for the first time since May last...",business,The category for this news article is: Business,0.21,False,,,,,,,,,
"Manufacturing recovery 'slowing'

UK manufacturing grew at its slowest pace in one-and-a-half years in January, accordin...",business,"The category for this news article is ""Business"" (Economy).",0.27,False,,,,,,,,,
"Worldcom boss 'left books alone'

Former Worldcom boss Bernie Ebbers, who is accused of overseeing an $11bn (£5.8bn) fra...",business,Business,0.17,True,,,,,,,,,
"Metlife buys up Citigroup insurer

US banking giant Citigroup has sold its Travelers Life & Annuity insurance arm to Met...",business,Business,0.13,True,,,,,,,,,
"Europe blames US over weak dollar

European leaders have openly blamed the US for the sharp rise in the value of the eur...",business,The provided news article can be categorized as **Economic News** or **Business**.,0.34,False,,,,,,,,,
"French wine gets 70m euro top-up

The French government is to hand its struggling wine industry 70m euros ($91m) in aid ...",business,Business,0.19,True,,,,,,,,,
"Russia gets investment blessing

Soaring oil sales and a budget surplus mean Russian debt is no longer a risky investmen...",business,This news article can be categorized as 'Business'.,0.26,False,,,,,,,,,
"Iranian MPs threaten mobile deal

Turkey's biggest private mobile firm could bail out of a $3bn ($1.6bn) deal to build a...",business,Business,0.17,True,,,,,,,,,
"Argentina closes $102.6bn debt swap

Argentina is set to close its $102.6bn (£53.51bn) debt restructuring offer for bond...",business,Business,0.17,True,,,,,,,,,
"US economy shows solid GDP growth

The US economy has grown more than expected, expanding at an annual rate of 3.8% in t...",business,Business,0.13,True,,,,,,,,,
"Profits slide at India's Dr Reddy

Profits at Indian drugmaker Dr Reddy's fell 93% as research costs rose and sales flag...",business,Business,0.16,True,,,,,,,,,
"Burren awarded Egyptian contracts

British energy firm Burren Energy has been awarded two potentially lucrative oil expl...",business,Business,0.12,True,,,,,,,,,
"'Strong dollar' call halts slide

The US dollar's slide against the euro and yen has halted after US Treasury Secretary ...",business,Business,0.19,True,,,,,,,,,
"IMF 'cuts' German growth estimate

The International Monetary Fund is to cut its 2005 growth forecast for the German eco...",business,Business,0.14,True,,,,,,,,,
"GM, Ford cut output as sales fall

US car firms General Motors (GM) and Ford have been forced to cut production in the f...",business,Economy,0.2,False,,,,,,,,,
"Ebbers denies WorldCom fraud

Former WorldCom chief Bernie Ebbers has denied claims that he knew accountants were doctor...",business,Business,0.17,True,,,,,,,,,
"Australia rates at four year high

Australia is raising its benchmark interest rate to its highest level in four years d...",business,Business,0.17,True,,,,,,,,,
"US company admits Benin bribery

A US defence and telecommunications company has agreed to pay $28.5m after admitting br...",business,Business,0.14,True,,,,,,,,,
"US insurer Marsh cuts 2,500 jobs

Up to 2,500 jobs are to go at US insurance broker Marsh & McLennan in a shake up follo...",business,Business,0.21,True,,,,,,,,,
"US seeks new $280bn smoker ruling

The US Justice Department is to try to overturn a court ruling that threw out its cla...",business,Business,0.18,True,,,,,,,,,
"Budget Aston takes on Porsche

British car maker Aston Martin has gone head-to-head with Porsche's 911 sports cars with ...",business,"The provided article is about the launch of a new car model by Aston Martin, the V8 Vantage, which is their most affordable car yet. The article mentions the price range, production details, and impact on the company's sales volume. Given this context, I would categorize this news article under ""Business.""",0.75,False,,,,,,,,,
"Golden rule 'intact' says ex-aide

Chancellor Gordon Brown will meet his golden economic rule ""with a margin to spare"", ...",business,Economy,0.17,False,,,,,,,,,
"Liberian economy starts to grow

The Liberian economy started to grow in 2004, but ""sustained and deep reform efforts"" a...",business,The article can be categorized as 'Business' or 'Economy'.,0.3,False,,,,,,,,,
"Slowdown hits US factory growth

US industrial production increased for the 21st month in a row in February, but at a sl...",business,The category for this news article is Business.,0.19,False,,,,,,,,,
"Lufthansa flies back to profit

German airline Lufthansa has returned to profit in 2004 after posting huge losses in 200...",business,Business,0.13,True,,,,,,,,,
"Japanese growth grinds to a halt

Growth in Japan evaporated in the three months to September, sparking renewed concern ...",business,"The provided news article can be categorized as ""Business"" due to its focus on economic matters such as the growth of Japan's economy, export numbers, corporate investment, and the impact of high oil prices on the Japanese market.",0.54,False,,,,,,,,,
"Unilever shake up as profit slips

Anglo-Dutch consumer goods giant Unilever is to merge its two management boards after...",business,Economy,0.23,False,,,,,,,,,
"France Telecom gets Orange boost

Strong growth in subscriptions to mobile phone network Orange has helped boost profits...",business,"This news article falls under the category of ""Business"".",0.26,False,,,,,,,,,
"Brussels raps mobile call charges

The European Commission has written to the mobile phone operators Vodafone and T-Mobi...",business,This news article falls under the category of **Business**.,0.26,False,,,,,,,,,
"WorldCom director admits lying

The former chief financial officer at US telecoms firm WorldCom has admitted before a Ne...",business,Business,0.17,True,,,,,,,,,
"Glaxo aims high after profit fall

GlaxoSmithKline saw its profits fall 9% last year to £6.2bn ($11.5bn), but Europe's b...",business,Business,0.13,True,,,,,,,,,
"Japan bank shares up on link talk

Shares of Sumitomo Mitsui Financial (SMFG), and Daiwa Securities jumped amid speculat...",business,Business,0.14,True,,,,,,,,,
"Car giant hit by Mercedes slump

A slump in profitability at luxury car maker Mercedes has prompted a big drop in profit...",business,Business,0.2,True,,,,,,,,,
"Ericsson sees earnings improve

Telecoms equipment supplier Ericsson has posted a rise in fourth quarter profits thanks ...",business,business,0.15,True,,,,,,,,,
"Bank opts to leave rates on hold

The Bank of England has left interest rates on hold at 4.75% for a sixth month in a ro...",business,Economy,0.2,False,,,,,,,,,
"Nigeria to boost cocoa production

The government of Nigeria is hoping to triple cocoa production over the next three ye...",business,Business,0.17,True,,,,,,,,,
"US interest rates increased to 2%

US interest rates are to rise for the fourth time in five months, in a widely anticip...",business,Economy,0.21,False,,,,,,,,,
"US bank in $515m SEC settlement

Five Bank of America subsidiaries have agreed to pay a total of $515m (£277m) to settle...",business,"The provided news article discusses a financial settlement between US Securities and Exchange Commission (SEC) and several subsidiaries of Bank of America, as well as former executives of Columbia Distributor. This incident is related to fraudulent trading practices involving mutual funds. Therefore, the category for this news article is ""Business"" or ""Finance"".",0.84,False,,,,,,,,,
"Train strike grips Buenos Aires

A strike on the Buenos Aires underground has caused traffic chaos and large queues at b...",business,This news article falls under the category of Politics.,0.2,False,,,,,,,,,
"Bargain calls widen Softbank loss

Japanese communications firm Softbank has widened losses after heavy spending on a ne...",business,Business,0.13,True,,,,,,,,,
"WMC profits up amid bid criticism

Australian mining firm WMC Resources has seen a fivefold rise in profits while contin...",business,Business,0.14,True,,,,,,,,,
"Barclays profits hit record level

Barclays, the UK's third-biggest bank, has seen annual pre-tax profits climb to recor...",business,Business,0.18,True,,,,,,,,,
